{
  "schema": "rocketlaboratory.experiment.v1",
  "name": "Independent two-car inputs",
  "description": "Offline hook investigation. Native timing and hidden-state restore remain unqualified. Demo mode is synthetic.",
  "duration_steps": 240,
  "preparation": "settled_floor",
  "actors": [
    {
      "car_index": 0,
      "segments": [
        {
          "start_step": 30,
          "duration_steps": 120,
          "controls": {
            "throttle": 1
          }
        }
      ]
    },
    {
      "car_index": 1,
      "segments": [
        {
          "start_step": 60,
          "duration_steps": 120,
          "controls": {
            "throttle": -0.5
          }
        }
      ]
    }
  ],
  "motion_policy": "planar"
}
