{
  "schema": "rocketlaboratory.experiment.v1",
  "name": "Throttle step response",
  "description": "Offline hook investigation. Native timing and hidden-state restore remain unqualified. Demo mode is synthetic.",
  "duration_steps": 360,
  "preparation": "settled_floor",
  "actors": [
    {
      "car_index": 0,
      "segments": [
        {
          "start_step": 60,
          "duration_steps": 240,
          "controls": {
            "throttle": 1
          }
        }
      ]
    }
  ],
  "motion_policy": "planar"
}
